{
  "$schema": "../schemas/server-definition.schema.json",
  "id": "space.syntheticuserlab-mcp",
  "name": "SyntheticUser Lab MCP",
  "alias": "syntheticuserlab",
  "description": "Synthetic user testing, UX validation, analytics, checkout, and readiness as a paid remote MCP.",
  "logo": "https://syntheticuserlab.space/favicon.svg",
  "schema_version": "2.1",
  "categories": [
    "ai-ml",
    "developer-tools"
  ],
  "tags": [
    "synthetic-users",
    "ux-research",
    "remote-mcp",
    "paid-mcp"
  ],
  "transport": {
    "type": "http",
    "url": "https://syntheticuserlab.space/mcp",
    "headers": {
      "Authorization": "Bearer ${input:SYNTHETICUSERLAB_TOKEN}"
    },
    "metadata": {
      "inputs": [
        {
          "id": "SYNTHETICUSERLAB_TOKEN",
          "label": "SyntheticUser Lab MCP Bearer Token",
          "type": "text",
          "required": true,
          "secret": true,
          "description": "Bearer token issued after checkout and MCP token claim.",
          "placeholder": "mcp_token...",
          "obtain": {
            "url": "https://syntheticuserlab.space/pricing/?utm_source=mcpmux&utm_medium=directory&utm_campaign=sbl202605",
            "instructions": "1. Buy a plan.\n2. Complete checkout.\n3. Claim the MCP bearer token.\n4. Paste the token value here without the Bearer prefix.",
            "button_label": "Get Token"
          }
        }
      ]
    }
  },
  "auth": {
    "type": "api_key",
    "instructions": "Use the Bearer token issued after checkout and MCP token claim."
  },
  "contributor": {
    "name": "SyntheticUser Lab",
    "github": "clauxel",
    "url": "https://syntheticuserlab.space/?utm_source=mcpmux&utm_medium=directory&utm_campaign=sbl202605"
  },
  "links": {
    "repository": "https://github.com/clauxel/synthetic-user-testing-mcp",
    "homepage": "https://syntheticuserlab.space/?utm_source=mcpmux&utm_medium=directory&utm_campaign=sbl202605",
    "documentation": "https://github.com/clauxel/synthetic-user-testing-mcp/blob/main/docs/usage.md"
  },
  "platforms": [
    "all"
  ],
  "capabilities": {
    "tools": true,
    "resources": false,
    "prompts": false,
    "read_only_mode": true
  }
}
