{
  "$schema": "../schemas/server-definition.schema.json",
  "id": "com.clauxel-dbqueryguard",
  "name": "DB Query Guard MCP",
  "alias": "dbqueryguard",
  "description": "Governed database query review, SQL simulation, approvals, and audits as a paid remote MCP.",
  "logo": "https://dbqueryguard.clauxel.com/favicon.svg",
  "schema_version": "2.1",
  "categories": [
    "database",
    "security"
  ],
  "tags": [
    "database-security",
    "sql-review",
    "query-governance",
    "remote-mcp"
  ],
  "transport": {
    "type": "http",
    "url": "https://dbqueryguard.clauxel.com/mcp",
    "headers": {
      "Authorization": "Bearer ${input:DBQUERYGUARD_TOKEN}"
    },
    "metadata": {
      "inputs": [
        {
          "id": "DBQUERYGUARD_TOKEN",
          "label": "DB Query Guard MCP Bearer Token",
          "type": "text",
          "required": true,
          "secret": true,
          "description": "Bearer token issued after checkout and MCP token claim.",
          "placeholder": "mcp_token...",
          "obtain": {
            "url": "https://dbqueryguard.clauxel.com/pricing/?utm_source=mcpmux&utm_medium=directory&utm_campaign=sbl202605",
            "instructions": "1. Buy a plan.\n2. Complete checkout.\n3. Claim the MCP bearer token.\n4. Paste the token value here without the Bearer prefix.",
            "button_label": "Get Token"
          }
        }
      ]
    }
  },
  "auth": {
    "type": "api_key",
    "instructions": "Use the Bearer token issued after checkout and MCP token claim."
  },
  "contributor": {
    "name": "DB Query Guard",
    "github": "clauxel",
    "url": "https://dbqueryguard.clauxel.com/?utm_source=mcpmux&utm_medium=directory&utm_campaign=sbl202605"
  },
  "links": {
    "repository": "https://github.com/clauxel/db-query-guard-mcp",
    "homepage": "https://dbqueryguard.clauxel.com/?utm_source=mcpmux&utm_medium=directory&utm_campaign=sbl202605",
    "documentation": "https://github.com/clauxel/db-query-guard-mcp/blob/main/docs/usage.md"
  },
  "platforms": [
    "all"
  ],
  "capabilities": {
    "tools": true,
    "resources": false,
    "prompts": false,
    "read_only_mode": true
  }
}
