{
  "$schema": "../schemas/server-definition.schema.json",
  "id": "com.clauxel-mcpriskledger",
  "name": "MCP Risk Ledger MCP",
  "alias": "mcpriskledger",
  "description": "MCP server intake risk reports, tool review, approvals, and readiness as a paid remote MCP.",
  "logo": "https://mcpriskledger.clauxel.com/favicon.svg",
  "schema_version": "2.1",
  "categories": [
    "security",
    "developer-tools"
  ],
  "tags": [
    "mcp-security",
    "risk-ledger",
    "tool-review",
    "remote-mcp"
  ],
  "transport": {
    "type": "http",
    "url": "https://mcpriskledger.clauxel.com/mcp",
    "headers": {
      "Authorization": "Bearer ${input:MCPRISKLEDGER_TOKEN}"
    },
    "metadata": {
      "inputs": [
        {
          "id": "MCPRISKLEDGER_TOKEN",
          "label": "MCP Risk Ledger MCP Bearer Token",
          "type": "text",
          "required": true,
          "secret": true,
          "description": "Bearer token issued after checkout and MCP token claim.",
          "placeholder": "mcp_token...",
          "obtain": {
            "url": "https://mcpriskledger.clauxel.com/pricing/?utm_source=mcpmux&utm_medium=directory&utm_campaign=sbl202605",
            "instructions": "1. Buy a plan.\n2. Complete checkout.\n3. Claim the MCP bearer token.\n4. Paste the token value here without the Bearer prefix.",
            "button_label": "Get Token"
          }
        }
      ]
    }
  },
  "auth": {
    "type": "api_key",
    "instructions": "Use the Bearer token issued after checkout and MCP token claim."
  },
  "contributor": {
    "name": "MCP Risk Ledger",
    "github": "clauxel",
    "url": "https://mcpriskledger.clauxel.com/?utm_source=mcpmux&utm_medium=directory&utm_campaign=sbl202605"
  },
  "links": {
    "repository": "https://github.com/clauxel/mcp-risk-ledger",
    "homepage": "https://mcpriskledger.clauxel.com/?utm_source=mcpmux&utm_medium=directory&utm_campaign=sbl202605",
    "documentation": "https://github.com/clauxel/mcp-risk-ledger/blob/main/docs/usage.md"
  },
  "platforms": [
    "all"
  ],
  "capabilities": {
    "tools": true,
    "resources": false,
    "prompts": false,
    "read_only_mode": true
  }
}
