{
  "$schema": "../schemas/server-definition.schema.json",
  "id": "com.clauxel-toolbudgetrouter",
  "name": "ToolBudget Router MCP",
  "alias": "toolbudgetrouter",
  "description": "Context-budget routing, schema cost estimates, usage audits, and readiness as a paid remote MCP.",
  "logo": "https://toolbudgetrouter.clauxel.com/favicon.svg",
  "schema_version": "2.1",
  "categories": [
    "developer-tools",
    "ai-ml"
  ],
  "tags": [
    "tool-routing",
    "context-budget",
    "schema-cost",
    "remote-mcp"
  ],
  "transport": {
    "type": "http",
    "url": "https://toolbudgetrouter.clauxel.com/mcp",
    "headers": {
      "Authorization": "Bearer ${input:TOOLBUDGETROUTER_TOKEN}"
    },
    "metadata": {
      "inputs": [
        {
          "id": "TOOLBUDGETROUTER_TOKEN",
          "label": "ToolBudget Router MCP Bearer Token",
          "type": "text",
          "required": true,
          "secret": true,
          "description": "Bearer token issued after checkout and MCP token claim.",
          "placeholder": "mcp_token...",
          "obtain": {
            "url": "https://toolbudgetrouter.clauxel.com/pricing/?utm_source=mcpmux&utm_medium=directory&utm_campaign=sbl202605",
            "instructions": "1. Buy a plan.\n2. Complete checkout.\n3. Claim the MCP bearer token.\n4. Paste the token value here without the Bearer prefix.",
            "button_label": "Get Token"
          }
        }
      ]
    }
  },
  "auth": {
    "type": "api_key",
    "instructions": "Use the Bearer token issued after checkout and MCP token claim."
  },
  "contributor": {
    "name": "ToolBudget Router",
    "github": "clauxel",
    "url": "https://toolbudgetrouter.clauxel.com/?utm_source=mcpmux&utm_medium=directory&utm_campaign=sbl202605"
  },
  "links": {
    "repository": "https://github.com/clauxel/tool-budget-router-mcp",
    "homepage": "https://toolbudgetrouter.clauxel.com/?utm_source=mcpmux&utm_medium=directory&utm_campaign=sbl202605",
    "documentation": "https://github.com/clauxel/tool-budget-router-mcp/blob/main/docs/usage.md"
  },
  "platforms": [
    "all"
  ],
  "capabilities": {
    "tools": true,
    "resources": false,
    "prompts": false,
    "read_only_mode": true
  }
}
